รหัสบัตรประชาชน,ตำแหน่งทางวิชาการ,คำนำหน้า,ชื่อ,นามสกุล,เพศ,เลขที่อัตรา,ประเภทพนักงาน,ตำแหน่งงาน,ลำดับขั้น,คณะวิชา/สำนัก,ภาควิชา / สำนัก,สายงาน,วัน-เดือน-ปีที่บรรจุ,เงินเดือนปัจจุบัน,ปรับเงินเดือนวันที่,ที่อยู่,เบอร์ติดต่อภายใน,เบอร์โทร,เบอร์มือถือ,อีเมลล์,วัน-เดือน-ปีเกิด,สถานะ
4.56E+12,ศาสตราจารย์,นาย,วราภรณ์,กุลสวัสดิ์ภักดี,ชาย,36546,ข้าราชการ,เจ้าหน้าที่สวัสดิการ,c3,สวัสดิการ,ประกันสุขภาพกลุ่ม,สนับสนุนวิชาการ,1/10/2530,200000,1/10/2558,118 ถ.ถวิลราษฎรบูรณะ ต.บ่อพลับ อ.เมือง จ.นครปฐม 73000,25470900,25470900,093-292-9262,benz.21@windowslive.com,1/12/2500,ยังอยู่
7.99E+12,,นาย,กิตติพงศ์,ทุมวิภาต,ชาย,36598,พนักงานมหาวิทยาลัย,เจ้าหน้าที่สหกิจ,c4,สวัสดิการ,กองทุน,สนับสนุนวิชาการ,1/10/2532,198000,1/10/2558,ซอยกำนันแม้น 13 แยก 27 บ้านเลขที่ 93 เขตบางบอน กทม 10150 จ้า,25470907,25470907,093-292-9646,p.90_AK@hotmail.com,1/12/2500,ยังอยู่
1.87E+12,,นาง,วิไล,เคียงประดู่,หญิง,36597,พนักงานจ้างหลังเกษียน,อาจารย์ประจำภาควิชาสถิติประยุกต์,6,คณะวิทยาศาสตร์ประยุกต์,ภาควิชาสถิติประยุกต์,วิชาการ,1/10/2540,90000,1/10/2558,49/84 ม.4 ต.เสาธงหิน อ.บางใหญ่ จ.นนทบุรี 11140,25410909,25410909,093-292-9691,gotza1567_@hotmail.com,1/12/2500,ยังอยู่
3.96E+12,ดร,ม.ล,วิฏราธร ,จิรประวัติ,ชาย,36548,ข้าราชการ,อาจารย์ประจำภาควิชาวิทยาการคอมพิวเตอร์และสารสนเทศ,c8,คณะวิทยาศาสตร์ประยุกต์,ภาควิชาวิทยาการคอมพิวเตอร์และสารสนเทศ,วิชาการ,1/10/2542,85000,1/10/2558,306 บ้านเเสนสุข R51 ถนนอโศก-ดินเเดง เเขวงดินเเดง เขตดินเเดง กทม. 10400,25470901,25470901,062-254-1556,m.n.p.6_za@hotmail.com,1/12/2500,ยังอยู่
2.92E+12,ดร,นาย,ณัฐกิตติ์,ตั้งพูลสินธนา,ชาย,36577,พนักงานมหาวิทยาลัย,อาจารย์ประจำภาควิชาวิทยาการคอมพิวเตอร์และสารสนเทศ,c5,คณะวิทยาศาสตร์ประยุกต์,ภาควิชาวิทยาการคอมพิวเตอร์และสารสนเทศ,วิชาการ,1/10/2543,80000,1/10/2558,499/11 หมู่ 12 อุดมสุข 42 สุขุมวิท 103 บางนา กรุงเทพ 10260,25470902,25470902,093-292-9929,nongnang_data@hotmail.com,1/12/2500,ยังอยู่
8.65E+12,,นาย,ภูเบศ,แม้นทอง,ชาย,36877,ลูกจ้าง,อาจารย์ประจำภาควิศวกรรมเครื่องกล,c5,คณะวิศวะกรรมศาสตร์,ภาควิศวกรรมเครื่องกล,วิชาการ,1/10/2553,20000,1/10/2558,118/75 หมู่2 หมู่บ้านเสรีวิลล์ ถนนเทพารักษ์ ตำบลบางเสาธง อำเภอบางเสาธง จังหวัดสมุทรปราการ 10540,25470903,25470903,099-156-4541,nonbaza_952@hotmail.com,1/12/2500,ยังอยู่
2.92E+12,,นางสาว,ดวงกมล,โชตะนา,หญิง,36557,ลูกจ้าง,อาจารย์ประจำภาควิศวกรรมเครื่องกล,c4,คณะวิศวะกรรมศาสตร์,ภาควิศวกรรมเครื่องกล,วิชาการ,1/10/2525,400000,1/10/2558,318/15 หมู่บ้านเปี่ยมสุข หมู่ 2 ตำบลนอกเมือง อำเภอเมือง จังหวัดสุรินทร์ 32000,25470904,25470904,085-041-5656,poonpattara_@hotmail.com,1/12/2500,ยังอยู่
1.12E+12,,นาย,ประเสริฐ,วิวัฒนานนท์พงษ์,ชาย,36477,ข้าราชการ,อาจารย์ประจำภาควิศวกรรมเครื่องกล,c5,คณะวิศวะกรรมศาสตร์,ภาควิศวกรรมเครื่องกล,วิชาการ,1/10/2535,100000,1/10/2558,เลขที่22 ซ.พหลโยธิน35 ถ.พหลโยธิน แขวงลาดยาว เขตจตุจักร กทม. 10900,25470908,25470908,099-095-9199,im_possi_ble@live.com,1/12/2500,ยังอยู่
